{
  "schema": "ocs-profile/1",
  "name": "bootstrap",
  "kind": "milestone",
  "description": "Minimal entry-point programs: exit status, entry signature, source shape, basic stdout/stderr. No JSON, filesystem, assertion framework or embedded tests.",
  "select": {
    "levels": [
      "L00"
    ],
    "environment_within": [
      "stdout",
      "stderr"
    ]
  }
}

