{
  "schema": "ocs-profile/1",
  "name": "frontend",
  "kind": "milestone",
  "description": "Syntax and static acceptance/rejection only (modes parse and check, every level). A frontend pass is a frontend milestone, never full language conformance.",
  "select": {
    "levels": [
      "L00",
      "L01",
      "L02",
      "L03",
      "L04",
      "L05",
      "L06",
      "L07",
      "L08",
      "L09",
      "L10",
      "L11",
      "L12",
      "L13"
    ],
    "modes": [
      "parse",
      "check"
    ]
  }
}

